--
-- Subqueries in expressions
-- Non-correlated scalar subqueries, EXISTS, and IN (SELECT ...): each subplan
-- runs once and folds into the surrounding expression. Correlated subqueries
-- (referencing the outer row) are not covered here.
--
CREATE TABLE sq (id integer, val integer);
INSERT INTO sq VALUES (1, 10), (2, 20), (3, 30);
-- scalar subquery in the target list; with no alias PG names the column after
-- the subquery's single output column
SELECT (SELECT max(val) FROM sq);
 max 
-----
  30
(1 row)

-- a scalar subquery returning no rows is NULL
SELECT (SELECT val FROM sq WHERE id = 99) AS no_rows;
 no_rows 
---------
        
(1 row)

-- scalar subquery in a WHERE comparison, evaluated once
SELECT id FROM sq WHERE val > (SELECT min(val) FROM sq) ORDER BY id;
 id 
----
  2
  3
(2 rows)

-- EXISTS is true when the subquery yields any row; with no alias the column is
-- named "exists"
SELECT EXISTS (SELECT 1 FROM sq WHERE val = 20),
       EXISTS (SELECT 1 FROM sq WHERE val = 99) AS has_99;
 exists | has_99 
--------+--------
 t      | f
(1 row)

-- EXISTS ignores the subquery's target list, so an error there is never raised
SELECT EXISTS (SELECT 1 / 0 FROM sq) AS ignores_select_list;
 ignores_select_list 
---------------------
 t
(1 row)

-- NOT EXISTS negates it
SELECT id FROM sq WHERE NOT EXISTS (SELECT 1 FROM sq WHERE val > 100) ORDER BY id;
 id 
----
  1
  2
  3
(3 rows)

-- IN (SELECT ...): membership against the subquery's single column
SELECT id FROM sq WHERE val IN (SELECT val FROM sq WHERE val <> 20) ORDER BY id;
 id 
----
  1
  3
(2 rows)

-- NOT IN (SELECT ...)
SELECT id FROM sq WHERE val NOT IN (SELECT val FROM sq WHERE val = 20) ORDER BY id;
 id 
----
  1
  3
(2 rows)

-- IN with a NULL in the candidate set: three-valued logic (no match -> NULL)
SELECT 5 IN (SELECT val FROM (VALUES (10), (NULL)) AS v(val)) AS in_null_nomatch;
 in_null_nomatch 
-----------------
 
(1 row)

-- a real match short-circuits the NULL and returns true
SELECT 10 IN (SELECT val FROM (VALUES (10), (NULL)) AS v(val)) AS in_null_match;
 in_null_match 
---------------
 t
(1 row)

-- membership across differing string types: text tested against a char(n)
-- subquery column still compares equal
CREATE TABLE txt (t text);
CREATE TABLE chr (c char(3));
INSERT INTO txt VALUES ('foo');
INSERT INTO chr VALUES ('foo');
SELECT t, t IN (SELECT c FROM chr) AS matched FROM txt;
  t  | matched 
-----+---------
 foo | t
(1 row)

-- subqueries in DML predicates and assignments
DELETE FROM sq WHERE val IN (SELECT val FROM sq WHERE val > 25);
SELECT * FROM sq ORDER BY id;
 id | val 
----+-----
  1 |  10
  2 |  20
(2 rows)

UPDATE sq SET val = (SELECT max(val) FROM sq WHERE val < 25) WHERE id = 1;
SELECT * FROM sq ORDER BY id;
 id | val 
----+-----
  1 |  20
  2 |  20
(2 rows)

-- error: a scalar subquery that returns more than one row
SELECT (SELECT val FROM sq);
ERROR:  more than one row returned by a subquery used as an expression
